{
  "name": "基本信息",
  "contact": {
    "email": "2825507825@qq.com",
    "phone": "15541958707"
  },
  "basic_info": {
    "origin": "安徽省阜阳市",
    "birth_date": "2004年8月",
    "political_status": "共青团员            出生年月：2004年8月"
  },
  "skills": [
    "Java",
    "Python"
  ],
  "education": [
    {
      "school": "院校专业：东北大学  软件学院",
      "major": "东北大学  软件学院  软件工程专业  人工智能方向",
      "gpa": "90.15, 22/285"
    }
  ],
  "experience": [],
  "projects": [
    {
      "name": "国家级大学生创新创业",
      "description": "国家级大学生创新创业项目                                                              负责人"
    },
    {
      "name": "基于大模型的Java-Cangjie转译方法",
      "description": "项目主题：基于大模型的Java-Cangjie转译方法"
    },
    {
      "name": "负责工作：在基于大模型的代码跨语言转译中，我积极承担负责工作并引领完成该的多项核心任务与",
      "responsibilities": "在基于大模型的代码跨语言转译项目中，我积极承担负责工作并引领团队完成该项目的多项核心任务与挑战型需求开发，\n            我贯穿了理想通信代码过程中的全流程开发工作，成功构建了一个比较灵活的技术框架，并加以为理想通信设计了健壮性\n            的架构，实现了理想通信的代码转译服务，随后，我设计并开发了理想的Web部署方案，实现了理想编排的代码开发及交互功能，\n         "
    }
  ],
  "raw_text": "\n基本信息\n\n姓名：时晓龙                  籍贯：安徽省阜阳市\n政治面貌：共青团员            出生年月：2004年8月\n电话：15541958707            电子邮箱：2825507825@qq.com\n\n教育背景\n\n院校专业：东北大学  软件学院  软件工程专业  人工智能方向\n专业成绩：必修加权平均: 90.15; 加权排名: 22/285\n课程学习：计算机组成原理[90] 数据结构与算法[82] 操作系统[91] 计算机网络[91] 软件系统开发实训[99] 数据分析[93] \n         高等数学①[85] 高等数学①[91] 概率论与数理统计[87] 大学物理[100] 等\n\n英语能力与个人技能\n\n英语能力：CET-4、CET-6(504)  掌握C、Python、Java等编程语言\n荣誉奖项：国家励志奖学金\n\n竞赛情况\n\n国际数学建模竞赛             国家一等奖        团队负责人\n全国计算机系统能力大赛       国家三等奖        核心成员\n中国机器人及人工智能竞赛     省级三等奖        团队负责人\n全国大学生数学竞赛           银级一等奖        个人\n\n科研经历\n\n国家级大学生创新创业项目                                                              负责人\n◆ 项目主题：基于大模型的Java-Cangjie转译方法\n◆ 负责工作：在基于大模型的代码跨语言转译项目中，我积极承担负责工作并引领团队完成该项目的多项核心任务与挑战型需求开发，\n            我贯穿了理想通信代码过程中的全流程开发工作，成功构建了一个比较灵活的技术框架，并加以为理想通信设计了健壮性\n            的架构，实现了理想通信的代码转译服务，随后，我设计并开发了理想的Web部署方案，实现了理想编排的代码开发及交互功能，\n            成功构建了一个让知识图谱为核心的软件系统，并兼任项目开发及交互功能。\n\n软件系统开发实训                                                                      负责人\n◆ 项目主题：智慧课堂-知识图谱系统\n◆ 负责工作：在\"智慧课堂-知识图谱\"项目中，我作为核心开发者承担了多个关键系统的设计与实现，我完成了整装师范个产品面，\n            后端服务我采用J及父编辑框架和调试，后服务我完成了梳选师范监测及交叉键盘的全流程开发及文具，成功构建了较个\n            介入知识图谱师范构的软件系统，并完成了项目核心功能。\n"
}